{
  "$schema": "https://json-schema.org/draft/2020-12/schema",
  "$id": "https://github.com/oso-gato/dev-pair/shared/contracts/verdict.v1.schema.json",
  "title": "verdict v1",
  "description": "A tier-2 verdict: the host's answer to a verdict-request, or a merge-gate result. Reads artifacts, never opinions; bound to the exact sha validated; produced by a non-author.",
  "type": "object",
  "additionalProperties": false,
  "required": ["grammar", "v", "request", "subject", "sha", "result", "evidence", "by", "at"],
  "properties": {
    "grammar": { "const": "verdict" },
    "v": { "const": 1 },
    "request": {
      "type": "string",
      "minLength": 1,
      "description": "The ticket id this verdict answers."
    },
    "subject": {
      "type": "string",
      "minLength": 1,
      "description": "What was validated — the artifact under test (a tree, an image, a live service)."
    },
    "sha": {
      "type": "string",
      "pattern": "^[0-9a-f]{40}$",
      "description": "The exact head sha the verdict is bound to. A verdict unbound from a sha decides nothing."
    },
    "result": { "enum": ["GREEN", "RED"] },
    "evidence": {
      "type": "array",
      "minItems": 1,
      "items": {
        "type": "object",
        "additionalProperties": false,
        "required": ["kind", "ref"],
        "properties": {
          "kind": {
            "enum": ["log", "command-output", "hash", "artifact-ref"],
            "description": "The class of artifact the evidence reads."
          },
          "ref": {
            "type": "string",
            "minLength": 1,
            "description": "Where the artifact lives — a log path, a command line whose output is attached, a digest, or a resolvable reference."
          }
        }
      },
      "description": "At least one artifact. A verdict without evidence is testimony and is refused."
    },
    "by": {
      "type": "string",
      "minLength": 1,
      "description": "The non-author identity that produced the verdict (the host's validator, or the merge gate executor)."
    },
    "at": { "type": "string", "format": "date-time" }
  }
}
